{
  "slug": "postgame",
  "name": "Postgame AI",
  "brandName": "postgame AI",
  "brandWebsite": "getpostgame.ai",
  "clickTargetUrl": "https://getpostgame.ai",
  "postTargets": ["x"],
  "dataSource": "sports",
  "engageKeywords": ["coaching film review", "postgame analysis", "player development", "game film", "coaching staff"],
  "engageEnabled": false
}
